{
  "schema_version": "0.1",
  "source": {
    "id": "download-01-d8f9c37a5714",
    "path": "data\\acceptance\\frozen-20260910\\captures\\download-01.pcapng",
    "sha256": "d8f9c37a57146377948b4792d7b0d86b8c95c83d8f23ffb6fabf445eb518f11f",
    "range": {
      "start": 0,
      "end": 1844
    }
  },
  "status": "ok",
  "parameters": {
    "entropy_log_base": 2,
    "printable_ascii_range": [
      32,
      126
    ],
    "ascii_whitespace_bytes": [
      9,
      10,
      13
    ],
    "window_size": 256,
    "window_step": 256,
    "tail_window": "include_short_tail",
    "top_n": 8,
    "ngram_sizes": [
      2,
      3,
      4
    ],
    "pattern_limit": 20,
    "pattern_offset_limit": 32,
    "ngram_counting": "overlapping"
  },
  "global": {
    "length": 1844,
    "byte_counts": [
      480,
      40,
      21,
      7,
      9,
      0,
      26,
      0,
      2,
      2,
      17,
      1,
      3,
      17,
      0,
      1,
      6,
      3,
      1,
      0,
      2,
      1,
      2,
      2,
      16,
      2,
      1,
      0,
      0,
      0,
      1,
      0,
      60,
      0,
      0,
      0,
      2,
      2,
      0,
      1,
      17,
      7,
      0,
      1,
      32,
      14,
      15,
      7,
      24,
      26,
      25,
      8,
      26,
      11,
      15,
      10,
      17,
      3,
      12,
      6,
      8,
      1,
      0,
      1,
      28,
      6,
      1,
      7,
      4,
      16,
      16,
      4,
      11,
      1,
      1,
      2,
      18,
      16,
      1,
      1,
      16,
      0,
      1,
      5,
      11,
      1,
      1,
      3,
      9,
      10,
      0,
      0,
      2,
      1,
      1,
      3,
      12,
      27,
      10,
      27,
      15,
      48,
      11,
      4,
      9,
      23,
      0,
      4,
      15,
      2,
      27,
      30,
      20,
      0,
      20,
      11,
      41,
      11,
      5,
      6,
      3,
      6,
      0,
      0,
      1,
      0,
      0,
      26,
      2,
      1,
      1,
      9,
      3,
      2,
      1,
      1,
      4,
      1,
      1,
      2,
      5,
      2,
      0,
      0,
      0,
      2,
      0,
      0,
      0,
      0,
      0,
      0,
      2,
      0,
      3,
      10,
      0,
      0,
      0,
      0,
      15,
      0,
      0,
      0,
      0,
      0,
      0,
      1,
      0,
      0,
      0,
      2,
      0,
      19,
      2,
      14,
      0,
      0,
      0,
      0,
      2,
      0,
      0,
      0,
      0,
      0,
      0,
      0,
      2,
      0,
      0,
      0,
      0,
      1,
      13,
      0,
      1,
      0,
      0,
      0,
      0,
      0,
      1,
      0,
      3,
      0,
      0,
      0,
      2,
      0,
      0,
      13,
      0,
      0,
      0,
      3,
      0,
      0,
      0,
      1,
      1,
      0,
      0,
      0,
      2,
      0,
      0,
      13,
      0,
      1,
      0,
      0,
      0,
      0,
      12,
      0,
      0,
      2,
      3,
      0,
      0,
      0,
      0,
      0,
      0,
      0,
      13,
      0,
      0,
      0,
      0,
      0,
      0,
      0,
      3,
      22
    ],
    "byte_frequencies": [
      0.2603036876355748,
      0.021691973969631236,
      0.0113882863340564,
      0.003796095444685466,
      0.004880694143167028,
      0.0,
      0.014099783080260303,
      0.0,
      0.0010845986984815619,
      0.0010845986984815619,
      0.009219088937093275,
      0.0005422993492407809,
      0.0016268980477223427,
      0.009219088937093275,
      0.0,
      0.0005422993492407809,
      0.0032537960954446853,
      0.0016268980477223427,
      0.0005422993492407809,
      0.0,
      0.0010845986984815619,
      0.0005422993492407809,
      0.0010845986984815619,
      0.0010845986984815619,
      0.008676789587852495,
      0.0010845986984815619,
      0.0005422993492407809,
      0.0,
      0.0,
      0.0,
      0.0005422993492407809,
      0.0,
      0.03253796095444685,
      0.0,
      0.0,
      0.0,
      0.0010845986984815619,
      0.0010845986984815619,
      0.0,
      0.0005422993492407809,
      0.009219088937093275,
      0.003796095444685466,
      0.0,
      0.0005422993492407809,
      0.01735357917570499,
      0.007592190889370932,
      0.008134490238611713,
      0.003796095444685466,
      0.013015184381778741,
      0.014099783080260303,
      0.013557483731019523,
      0.004338394793926247,
      0.014099783080260303,
      0.00596529284164859,
      0.008134490238611713,
      0.005422993492407809,
      0.009219088937093275,
      0.0016268980477223427,
      0.006507592190889371,
      0.0032537960954446853,
      0.004338394793926247,
      0.0005422993492407809,
      0.0,
      0.0005422993492407809,
      0.015184381778741865,
      0.0032537960954446853,
      0.0005422993492407809,
      0.003796095444685466,
      0.0021691973969631237,
      0.008676789587852495,
      0.008676789587852495,
      0.0021691973969631237,
      0.00596529284164859,
      0.0005422993492407809,
      0.0005422993492407809,
      0.0010845986984815619,
      0.009761388286334056,
      0.008676789587852495,
      0.0005422993492407809,
      0.0005422993492407809,
      0.008676789587852495,
      0.0,
      0.0005422993492407809,
      0.0027114967462039045,
      0.00596529284164859,
      0.0005422993492407809,
      0.0005422993492407809,
      0.0016268980477223427,
      0.004880694143167028,
      0.005422993492407809,
      0.0,
      0.0,
      0.0010845986984815619,
      0.0005422993492407809,
      0.0005422993492407809,
      0.0016268980477223427,
      0.006507592190889371,
      0.014642082429501085,
      0.005422993492407809,
      0.014642082429501085,
      0.008134490238611713,
      0.026030368763557483,
      0.00596529284164859,
      0.0021691973969631237,
      0.004880694143167028,
      0.012472885032537961,
      0.0,
      0.0021691973969631237,
      0.008134490238611713,
      0.0010845986984815619,
      0.014642082429501085,
      0.016268980477223426,
      0.010845986984815618,
      0.0,
      0.010845986984815618,
      0.00596529284164859,
      0.022234273318872018,
      0.00596529284164859,
      0.0027114967462039045,
      0.0032537960954446853,
      0.0016268980477223427,
      0.0032537960954446853,
      0.0,
      0.0,
      0.0005422993492407809,
      0.0,
      0.0,
      0.014099783080260303,
      0.0010845986984815619,
      0.0005422993492407809,
      0.0005422993492407809,
      0.004880694143167028,
      0.0016268980477223427,
      0.0010845986984815619,
      0.0005422993492407809,
      0.0005422993492407809,
      0.0021691973969631237,
      0.0005422993492407809,
      0.0005422993492407809,
      0.0010845986984815619,
      0.0027114967462039045,
      0.0010845986984815619,
      0.0,
      0.0,
      0.0,
      0.0010845986984815619,
      0.0,
      0.0,
      0.0,
      0.0,
      0.0,
      0.0,
      0.0010845986984815619,
      0.0,
      0.0016268980477223427,
      0.005422993492407809,
      0.0,
      0.0,
      0.0,
      0.0,
      0.008134490238611713,
      0.0,
      0.0,
      0.0,
      0.0,
      0.0,
      0.0,
      0.0005422993492407809,
      0.0,
      0.0,
      0.0,
      0.0010845986984815619,
      0.0,
      0.010303687635574838,
      0.0010845986984815619,
      0.007592190889370932,
      0.0,
      0.0,
      0.0,
      0.0,
      0.0010845986984815619,
      0.0,
      0.0,
      0.0,
      0.0,
      0.0,
      0.0,
      0.0,
      0.0010845986984815619,
      0.0,
      0.0,
      0.0,
      0.0,
      0.0005422993492407809,
      0.0070498915401301515,
      0.0,
      0.0005422993492407809,
      0.0,
      0.0,
      0.0,
      0.0,
      0.0,
      0.0005422993492407809,
      0.0,
      0.0016268980477223427,
      0.0,
      0.0,
      0.0,
      0.0010845986984815619,
      0.0,
      0.0,
      0.0070498915401301515,
      0.0,
      0.0,
      0.0,
      0.0016268980477223427,
      0.0,
      0.0,
      0.0,
      0.0005422993492407809,
      0.0005422993492407809,
      0.0,
      0.0,
      0.0,
      0.0010845986984815619,
      0.0,
      0.0,
      0.0070498915401301515,
      0.0,
      0.0005422993492407809,
      0.0,
      0.0,
      0.0,
      0.0,
      0.006507592190889371,
      0.0,
      0.0,
      0.0010845986984815619,
      0.0016268980477223427,
      0.0,
      0.0,
      0.0,
      0.0,
      0.0,
      0.0,
      0.0,
      0.0070498915401301515,
      0.0,
      0.0,
      0.0,
      0.0,
      0.0,
      0.0,
      0.0,
      0.0016268980477223427,
      0.01193058568329718
    ],
    "entropy_bits_per_byte": 5.602570253042867,
    "printable_ascii_ratio": 0.5075921908893709,
    "ascii_whitespace_ratio": 0.019522776572668113,
    "zero_ratio": 0.2603036876355748,
    "top_bytes": [
      {
        "byte": 0,
        "hex": "00",
        "count": 480,
        "frequency": 0.2603036876355748
      },
      {
        "byte": 32,
        "hex": "20",
        "count": 60,
        "frequency": 0.03253796095444685
      },
      {
        "byte": 101,
        "hex": "65",
        "count": 48,
        "frequency": 0.026030368763557483
      },
      {
        "byte": 116,
        "hex": "74",
        "count": 41,
        "frequency": 0.022234273318872018
      },
      {
        "byte": 1,
        "hex": "01",
        "count": 40,